{
  "$schema": "http://json-schema.org/draft-07/schema#",
  "$id": "https://archstudio.mjolnix.com.br/schema/archstudio.schema.json",
  "title": "ArchStudio diagram spec",
  "description": "Agent-friendly architecture diagram spec for ArchStudio (https://archstudio.mjolnix.com.br). Omit node x/y and the built-in auto-layout arranges the flow left-to-right following the edges. Load via the app's 📂 button, via URL '#d=j:<base64url(JSON)>' or '?src=<url>'.",
  "type": "object",
  "required": ["nodes"],
  "additionalProperties": false,
  "properties": {
    "name": {
      "type": "string",
      "description": "Diagram title shown in the top bar and in exports."
    },
    "boxes": {
      "type": "array",
      "description": "Dashed group containers (e.g. 'AWS us-east-1', 'On-premise'). Nodes reference them via their 'box' property; the box is sized automatically around its members.",
      "items": {
        "type": "object",
        "required": ["id", "label"],
        "additionalProperties": false,
        "properties": {
          "id": { "type": ["string", "number"], "description": "Key referenced by nodes' 'box' property." },
          "label": { "type": "string", "maxLength": 40 },
          "lock": { "type": "boolean", "description": "Pin the item: it is not moved, copied, deleted or picked by the lasso — and the AI will not remove it." },
          "comment": { "type": "string", "description": "Free-text annotation shown as a marker on the item; the full text appears on hover or when comments are toggled on. Any item can have one." },
          "grp": { "type": "number", "description": "Group id: items sharing the same grp are selected and moved together in the editor (Ctrl+G)." },
          "rot": { "type": "number", "description": "Rotation in degrees. The editor snaps to 15° steps while the grid magnet is on." },
          "color": { "type": "string", "pattern": "^#[0-9a-fA-F]{6}$", "description": "Optional hex color; a palette color is picked when omitted." }
        }
      }
    },
    "nodes": {
      "type": "array",
      "minItems": 1,
      "items": {
        "type": "object",
        "required": ["id", "type"],
        "additionalProperties": false,
        "properties": {
          "id": { "type": ["string", "number"], "description": "Unique key referenced by edges." },
          "type": {
            "type": "string",
            "description": "Component type. Unknown values fall back to 'api'.",
            "enum": [
              "c4person", "c4extperson", "c4system", "c4extsystem", "c4container", "c4component", "c4db", "c4queue",
              "natgw", "tgw", "ecr", "apprunner", "efs", "documentdb", "athena", "glue", "appsync", "firehose",
              "ssm", "acm", "cloudtrail", "guardduty", "rekognition", "textract", "comprehend",
              "cloudformation", "codepipeline", "codebuild",
              "appengine", "spanner", "bigtable", "dataflow", "cloudtasks", "apigee", "gclb", "cloudarmor", "gcpsecrets",
              "containerapps", "aci", "azredis", "azpostgres", "synapse", "apim", "eventgrid", "logicapps", "keyvault", "azaisearch",
              "user", "browser", "mobile", "iot", "partner",
              "route53", "cloudfront", "waf", "apigw", "alb", "nlb", "vpc",
              "ec2", "ecs", "eks", "fargate", "lambda", "batch",
              "s3", "rds", "aurora", "dynamodb", "elasticache", "redshift", "opensearch", "glacier",
              "sqs", "sns", "eventbridge", "kinesis", "msk", "stepfn", "ses",
              "iam", "cognito", "secretsmgr", "kms", "cloudwatch", "xray",
              "bedrock", "sagemaker",
              "cloudrun", "gke", "cloudfn", "gce", "gcs", "cloudsql", "firestore", "bigquery", "pubsub", "memorystore", "vertexai",
              "appservice", "aks", "azfunc", "azvm", "blob", "azsql", "cosmosdb", "servicebus", "eventhubs", "frontdoor", "entra", "azureopenai",
              "llm", "aiagent", "orchestrator", "tool", "vectordb", "embeddings", "mcp", "guardrail", "gpu",
              "docsource", "chunking", "retriever", "reranker", "promptbuild", "semcache", "aimemory", "ragas", "llmobs",
              "funcao", "edgefn", "faasqueue", "container",
              "api", "worker", "queue", "stream", "dlq", "outbox", "db", "cache", "lb", "gateway", "auth", "sched", "obs", "extern", "k8s", "cdngen", "storagegen",
              "server", "vm", "dbonprem", "mainframe", "firewall", "nas", "ad", "vpn", "dc"
            ]
          },
          "label": { "type": "string", "maxLength": 42, "description": "Display name; defaults to the type's catalog name." },
          "box": { "type": ["string", "number"], "description": "Id of the box this node belongs to." },
          "s": { "type": "number", "minimum": 0.6, "maximum": 2.2, "description": "Scale factor (default 1)." },
          "style": { "type": "string", "enum": ["card", "icon"], "description": "'card' = full card (default); 'icon' = borderless large icon." },
          "color": { "type": "string", "pattern": "^#[0-9a-fA-F]{6}$", "description": "Optional accent color override (border/icon); defaults to the category color." },
          "lock": { "type": "boolean", "description": "Pin the item: it is not moved, copied, deleted or picked by the lasso — and the AI will not remove it." },
          "comment": { "type": "string", "description": "Free-text annotation shown as a marker on the item; the full text appears on hover or when comments are toggled on. Any item can have one." },
          "grp": { "type": "number", "description": "Group id: items sharing the same grp are selected and moved together in the editor (Ctrl+G)." },
          "rot": { "type": "number", "description": "Rotation in degrees. The editor snaps to 15° steps while the grid magnet is on." },
          "tech": { "type": "string", "maxLength": 40, "description": "C4-style technology, rendered as [Spring Boot] under the name. Works on ANY type, not just c4* ones." },
          "desc": { "type": "string", "maxLength": 140, "description": "C4-style one-line description under the name/technology. Works on ANY type." },
          "multiple": { "type": "boolean", "description": "Draw the card as a stack, meaning several instances (replicas, pods, workers)." },
          "meta": { "type": "object", "description": "Operational metadata used for color-by/filter in the editor.", "additionalProperties": false, "properties": { "owner": { "type": "string" }, "team": { "type": "string" }, "env": { "type": "string" }, "repo": { "type": "string" }, "sla": { "type": "string" } } },
          "details": {
            "type": "array",
            "description": "Drill-down: sub-diagrams that describe this component from the inside. Open a node in the editor (button/badge) to view and edit them in a full-screen tabbed view. Optional; specs without it are unchanged.",
            "items": {
              "type": "object",
              "required": ["kind"],
              "properties": {
                "id": { "type": "string" },
                "kind": { "type": "string", "enum": ["sequence", "state", "arch"], "description": "sequence = participants + ordered messages; state = states + transitions (entity lifecycle); arch = a nested ArchStudio diagram (C4 drill-down: the next level down, contêiner -> componente)." },
                "name": { "type": "string", "maxLength": 60, "description": "Tab title." },
                "parts": { "type": "array", "description": "sequence only: participants/lifelines.", "items": { "type": "object", "required": ["id", "label"], "properties": { "id": { "type": "string" }, "label": { "type": "string" }, "type": { "type": "string", "enum": ["actor", "frontend", "mobile", "api", "service", "worker", "queue", "cache", "db", "auth", "ext"], "description": "participant drawing/icon. Default service." }, "color": { "type": "string", "description": "hex color for this participant (optional)." } } } },
                "msgs": { "type": "array", "description": "sequence only: messages in order (top to bottom).", "items": { "type": "object", "required": ["from", "to"], "properties": { "id": { "type": "string" }, "from": { "type": "string", "description": "participant id" }, "to": { "type": "string", "description": "participant id" }, "label": { "type": "string" }, "kind": { "type": "string", "enum": ["sync", "async", "reply"], "description": "UML: sync = solid line + filled arrowhead; async = solid line + open arrowhead; reply = dashed line + open arrowhead." }, "method": { "type": "string", "enum": ["", "GET", "POST", "PUT", "PATCH", "DELETE"], "description": "optional colored HTTP-verb badge before the label." } } } },
                "frags": { "type": "array", "description": "sequence only: combined fragments (a labeled box around a message range).", "items": { "type": "object", "required": ["type", "from", "to"], "properties": { "id": { "type": "string" }, "type": { "type": "string", "enum": ["loop", "alt", "opt", "par"] }, "label": { "type": "string", "description": "condition/guard shown in brackets." }, "from": { "type": "number", "description": "first message index (0-based, inclusive)." }, "to": { "type": "number", "description": "last message index (inclusive)." } } } },
                "states": { "type": "array", "description": "state only: nodes. x/y are the CENTER of each state.", "items": { "type": "object", "required": ["id", "kind"], "properties": { "id": { "type": "string" }, "kind": { "type": "string", "enum": ["start", "normal", "end", "decision", "fork"], "description": "normal=box, start=dot, end=ring, decision=diamond (label the outgoing transitions [yes]/[no]), fork=bar for parallel split/join." }, "label": { "type": "string" }, "color": { "type": "string", "description": "hex color for this state (optional)." }, "x": { "type": "number" }, "y": { "type": "number" } } } },
                "trans": { "type": "array", "description": "state only: transitions.", "items": { "type": "object", "required": ["from", "to"], "properties": { "id": { "type": "string" }, "from": { "type": "string", "description": "state id" }, "to": { "type": "string", "description": "state id" }, "label": { "type": "string" } } } },
                "doc": { "$ref": "#", "description": "arch (C4) only: a full nested ArchStudio spec (nodes/edges/boxes/texts) describing this component from the inside — the next C4 level. Recursive: nodes inside it can again carry their own details/doc. Prefer the c4container/c4component types here." }
              }
            }
          },
          "x": { "type": "number", "description": "Optional; omit to use auto-layout." },
          "y": { "type": "number", "description": "Optional; omit to use auto-layout." }
        }
      }
    },
    "edges": {
      "type": "array",
      "description": "Directed connections between nodes. In IaC generation these define wiring and least-privilege IAM.",
      "items": {
        "type": "object",
        "required": ["from", "to"],
        "additionalProperties": false,
        "properties": {
          "from": { "type": ["string", "number"] },
          "to": { "type": ["string", "number"] },
          "label": { "type": "string", "maxLength": 40, "description": "Protocol/action, e.g. 'SQL', 'publica', '202 Accepted'." },
          "dash": { "type": "boolean", "description": "Dashed line — conventionally async/background/fallback paths." },
          "route": { "enum": ["reta", "curva", "orto"], "description": "Line routing: straight (default), rounded curve, or right angles. Optional." },
          "pts": { "type": "array", "description": "Control points the user dragged on the canvas. Optional — leave it out and let the editor place the line.", "items": { "type": "object", "properties": { "x": { "type": "number" }, "y": { "type": "number" } }, "required": ["x", "y"] } },
          "lock": { "type": "boolean", "description": "Pin the item: it is not moved, copied, deleted or picked by the lasso — and the AI will not remove it." },
          "comment": { "type": "string", "description": "Free-text annotation shown as a marker on the item; the full text appears on hover or when comments are toggled on. Any item can have one." },
          "grp": { "type": "number", "description": "Group id: items sharing the same grp are selected and moved together in the editor (Ctrl+G)." },
          "heads": { "type": "string", "enum": ["end", "both", "none"], "default": "end" },
          "w": { "type": "number", "minimum": 1, "maximum": 6, "description": "Stroke width (default 2)." },
          "color": { "type": "string", "pattern": "^#[0-9a-fA-F]{6}$", "description": "Optional line/arrowhead color; defaults to the theme edge color." }
        }
      }
    },
    "texts": {
      "type": "array",
      "description": "Free-floating annotations — use them for key architectural decisions and constraints.",
      "items": {
        "type": "object",
        "required": ["text"],
        "additionalProperties": false,
        "properties": {
          "text": { "type": "string", "maxLength": 300 },
          "size": { "type": "number", "minimum": 10, "maximum": 34, "default": 14 },
          "bold": { "type": "boolean", "default": false },
          "italic": { "type": "boolean", "default": false },
          "color": { "type": "string", "pattern": "^#[0-9a-fA-F]{6}$", "description": "Optional hex text color; defaults to the theme ink color." },
          "align": { "type": "string", "enum": ["left", "center", "right"], "default": "left" },
          "frame": { "type": "boolean", "default": false, "description": "Render as a text box: a rounded rectangle with background and border that wraps text to 'w'." },
          "w": { "type": "number", "minimum": 90, "maximum": 600, "description": "Text box width in px (only when frame is true). Text wraps to this width." },
          "bg": { "type": "string", "pattern": "^#[0-9a-fA-F]{6}$", "description": "Text box background/border tint (only when frame is true); defaults to the theme card color." },
          "lock": { "type": "boolean", "description": "Pin the item: it is not moved, copied, deleted or picked by the lasso — and the AI will not remove it." },
          "comment": { "type": "string", "description": "Free-text annotation shown as a marker on the item; the full text appears on hover or when comments are toggled on. Any item can have one." },
          "grp": { "type": "number", "description": "Group id: items sharing the same grp are selected and moved together in the editor (Ctrl+G)." },
          "rot": { "type": "number", "description": "Rotation in degrees. The editor snaps to 15° steps while the grid magnet is on." },
          "x": { "type": "number" },
          "y": { "type": "number" }
        }
      }
    }
  }
}
